{
  "evidence": [
    {
      "agent_id": "aiq-001-weather",
      "artifact_reference": "sha256:47b75da56465d80d3bb06d45b2f94b6fc10374115e3c30114cc3d9931a4f60b3",
      "bundle_hash": "sha256:044d9953b18be6dac75d603b05f1ed9911cbcddbc7d2d1a861f1c9336cd97f9b",
      "phase": "healthy",
      "primary_judgment_targets": [
        {
          "insight_reference": "sha256:bf35b2084fa429a4c35dffe2e70d656eeefd683d3e3bd42d7d5fc171ff6dae9b",
          "judgment_target_reference": "sha256:d9e4982dab609598ccc6da94eaff38c455853085b9858e45eb80364fae789235"
        },
        {
          "insight_reference": null,
          "judgment_target_reference": "sha256:b9f7f2f0671a5e12afe541e72edd020aed73d6a210f1647263de3cf3a7244073"
        }
      ],
      "primary_package_reference": "sha256:14e7b354df89173b03c8f85ec4597d9c809ba8753f5122c0d9ffd8a412a782d3",
      "run_id": "run-00-aiq-001-weather",
      "scenario_id": "aiq-scn-002-expected-model-latency",
      "validation_targets": [
        "no_insight",
        "evidence"
      ]
    },
    {
      "agent_id": "aiq-002-healthcare",
      "artifact_reference": "sha256:1313ae70c717d128185b839125ac0512b04a1f674aba08e1aa7ca7873fa3210e",
      "bundle_hash": "sha256:b771a1547cc1959593879fe0c4eb93cdb5ed21cd465f3fca27b1c25f2682efde",
      "phase": "healthy",
      "primary_judgment_targets": [
        {
          "insight_reference": "sha256:5f0fcfb8acfabe850397b2cc3678b5437345be909b510376403890d649689ca7",
          "judgment_target_reference": "sha256:2a592a32ab8fa239850074cb14ef7c4cba27acb59944b0107f142867b1f799cd"
        },
        {
          "insight_reference": null,
          "judgment_target_reference": "sha256:cdce784ee25def81d04483203f29e8e76ac5c03f33a605215c019d5934c78492"
        }
      ],
      "primary_package_reference": "sha256:6ecc72d78db1614c34376fd34f23159342dc8c980bd5eb4d1de05b399c9d4361",
      "run_id": "run-00-aiq-002-healthcare",
      "scenario_id": "aiq-scn-057-handled-child-failure-control",
      "validation_targets": [
        "no_insight",
        "evidence"
      ]
    },
    {
      "agent_id": "aiq-003-finance",
      "artifact_reference": "sha256:bada29b3aded4a07e208e1beff3706d35cf3e719d102d4492b1bff6becce6d04",
      "bundle_hash": "sha256:cde32b3ef31b57fa8925936b7ff0c9b1dbc10f5cb21fa669891c5cfb468bb654",
      "phase": "healthy",
      "primary_judgment_targets": [
        {
          "insight_reference": "sha256:15964e1391b3f776762f7315a0fe30dbc8c7ecafaa3bcc092e9c9fcb25b9f59a",
          "judgment_target_reference": "sha256:93a694fcef59efe7ef293eb832ab74cc7666c41d563c28e776e7726358c26954"
        },
        {
          "insight_reference": null,
          "judgment_target_reference": "sha256:1daa9c8c5096fee8a7ba07401def76673303281ba5a5b47647d8fb2f2a8f7c9b"
        }
      ],
      "primary_package_reference": "sha256:76c1dde8aadaaed9da2e7681f9225e94c837eb855cf55ab6754058d3d646f686",
      "run_id": "run-00-aiq-003-finance",
      "scenario_id": "aiq-scn-003-handled-transient-failure",
      "validation_targets": [
        "no_insight",
        "evidence"
      ]
    },
    {
      "agent_id": "aiq-003-finance",
      "artifact_reference": "sha256:991a051953277507b20953d0092883ca656653d7fa411681b2d68fb991901bc8",
      "bundle_hash": "sha256:e5ec0cb0bb23b19bf4e75951d65c82b185fbe6ca652b9fdb751e4a23ce27c3d1",
      "phase": "healthy",
      "primary_judgment_targets": [
        {
          "insight_reference": null,
          "judgment_target_reference": "sha256:214321a3afe2bedfd00ef31bcb74e8153a6f35e7b0b7c9d2d4c2cfac6f1b77e9"
        }
      ],
      "primary_package_reference": "sha256:73e53bd8a38cdd070739be3ec2a8c6e8d9444b067fe585c2f06df38023017756",
      "run_id": "run-00-aiq-003-finance",
      "scenario_id": "aiq-scn-056-outer-zero-token-control",
      "validation_targets": [
        "no_insight",
        "evidence"
      ]
    },
    {
      "agent_id": "aiq-004-travel",
      "artifact_reference": "sha256:3e06eadc33d9fe05710289bbb20d23e6d28439adde889905cbf280248b3a6ddc",
      "bundle_hash": "sha256:9d3ac6e278cf5de7bfeea388a4874ef42f8d3f11e020aeac64cf7db6e30f35b1",
      "phase": "healthy",
      "primary_judgment_targets": [
        {
          "insight_reference": "sha256:281072e8e99b9dd22f425c35441c196ab8ebcbca0447ac40a8cfb1991e055c3f",
          "judgment_target_reference": "sha256:437cd945a5de9a8f9086dff2794771534af8f8b1e28fbf3badbfc9d465508d59"
        },
        {
          "insight_reference": null,
          "judgment_target_reference": "sha256:4827fdea314cd88da0757967c666a71e2969d305ed894c2f78ae401d1f8be007"
        }
      ],
      "primary_package_reference": "sha256:1bdd380300313a7e791b2712d2d87d2ab7e624d85968958932961b42dec65b6c",
      "run_id": "run-00-aiq-004-travel",
      "scenario_id": "aiq-scn-001-fully-healthy",
      "validation_targets": [
        "no_insight",
        "evidence"
      ]
    },
    {
      "agent_id": "aiq-005-ticket",
      "artifact_reference": "sha256:929c97978695952666e543b657bab3fb935acf858926b46b48993fa0ad52bdd1",
      "bundle_hash": "sha256:f42f1a58337512e7cf92c063bfd0f251300848acfe883ad3d273bf3ee02b0772",
      "phase": "healthy",
      "primary_judgment_targets": [
        {
          "insight_reference": "sha256:5e78712975b6712238dc2e94a4ea5d58ac1ca834d5079d1087d429ee883ea119",
          "judgment_target_reference": "sha256:eb429829690284bf8fd9c39a130c761b2660f59a3ddfeb1a3c3243c0d044a82d"
        },
        {
          "insight_reference": null,
          "judgment_target_reference": "sha256:9562b882dd5c62e31f98701df3aa4de9a8c1b0c350d7ddc6ca225b8bec9b9636"
        }
      ],
      "primary_package_reference": "sha256:c508adcd62e43a04e39e7de69618067b01f4ab08a59bb70bcf2fe6e2de8678c2",
      "run_id": "run-00-aiq-005-ticket",
      "scenario_id": "aiq-scn-004-ordinary-token-use",
      "validation_targets": [
        "no_insight",
        "evidence"
      ]
    },
    {
      "agent_id": "aiq-001-weather",
      "artifact_reference": "sha256:7a48d48074c7855adb0feb48b173cdb8430ecf1ba3487100c9377265b8cfb7db",
      "bundle_hash": "sha256:2a1dc1b738d5a5dbf38017253cb5b754358c05c5ff7552b8e87db712419409ce",
      "phase": "faulted",
      "primary_judgment_targets": [
        {
          "insight_reference": "sha256:ad3466835fc1d872b0f35ecd843ee556b2ec33bb0eb6226b5786c2d91d01f011",
          "judgment_target_reference": "sha256:bc506286b078af34f3aed74ff10effd73ec825d1ed6724f82bd0e2d78feeb570"
        },
        {
          "insight_reference": null,
          "judgment_target_reference": "sha256:4f79b489bde4f15b11daec722046964717ee80db9079f58581ec7c76357157b5"
        }
      ],
      "primary_package_reference": "sha256:ab1230eaaef27a3927262730b996e1225e2d8157f144126f922b7bac58e0b806",
      "run_id": "run-01-aiq-001-weather",
      "scenario_id": "aiq-scn-005-hallucinated-answer",
      "validation_targets": [
        "root_cause",
        "title",
        "description",
        "category",
        "severity",
        "proposed_fix",
        "evidence"
      ]
    },
    {
      "agent_id": "aiq-001-weather",
      "artifact_reference": "sha256:9bd7da1e715182972f4817f173683cb7a6fe30e1d6ff8f1344c993ad83461acf",
      "bundle_hash": "sha256:6493ae9edb6473f23e56fcded0e2c70731da2c7531da4347eb10fb01bcc57d64",
      "phase": "faulted",
      "primary_judgment_targets": [
        {
          "insight_reference": "sha256:df59e2446836ed6d95e6fe844aa4045a6d66f0215a96f8e63abdc432e146b761",
          "judgment_target_reference": "sha256:5ebed47953ffcd8cc504f6bf8a427e3e4ab96ae377ede3b61b9a06681a3c0ead"
        },
        {
          "insight_reference": null,
          "judgment_target_reference": "sha256:a3bfb2090b9bf37f247761bca09ff0eb9bef1267c6d848bab675710dcdd33521"
        }
      ],
      "primary_package_reference": "sha256:b75a9ea438f3f66e41884a2eeb8118fdcf9ee0c88084080f26091e0db4732a0b",
      "run_id": "run-01-aiq-001-weather",
      "scenario_id": "aiq-scn-030-unsupported-action-attempt",
      "validation_targets": [
        "root_cause",
        "title",
        "description",
        "category",
        "severity",
        "proposed_fix",
        "evidence"
      ]
    },
    {
      "agent_id": "aiq-001-weather",
      "artifact_reference": "sha256:78e62a4005cb8c3181e5885c9be1f36cb12d19b6d9a6c3858633edb23f885109",
      "bundle_hash": "sha256:414ed6cc00cc1f6fb0edcfb613c2d86b285e3501cdca1a767c71b8e5c2e57544",
      "phase": "faulted",
      "primary_judgment_targets": [
        {
          "insight_reference": null,
          "judgment_target_reference": "sha256:dc67e020bec677142a6fbbee38c3f700576d9b256821ab75bab35a69380cf1e4"
        }
      ],
      "primary_package_reference": "sha256:533c5b8095ecc20afb0f4581e8e2372df887004a95ee21006148daa2daff2464",
      "run_id": "run-01-aiq-001-weather",
      "scenario_id": "aiq-scn-040-omitted-required-fields",
      "validation_targets": [
        "root_cause",
        "title",
        "description",
        "category",
        "severity",
        "proposed_fix",
        "evidence"
      ]
    },
    {
      "agent_id": "aiq-001-weather",
      "artifact_reference": "sha256:c22e76a0da21cad9e77d60eaa863ccdfca09a9ae94a1bd7da528c7a039fc931e",
      "bundle_hash": "sha256:7a84198634233082dc3c445a904927700230640992617cfac2ecc43530dab16a",
      "phase": "faulted",
      "primary_judgment_targets": [
        {
          "insight_reference": "sha256:32fb2ee73459938ae08096fdbb06995d82f86375427e4ed74cc40b018eed53cc",
          "judgment_target_reference": "sha256:e9ba0959c1365971cd03d0826d57a83bdb9615f4f5d9fc54ebae131cd1709aea"
        },
        {
          "insight_reference": "sha256:2bc512952152603562642f6fe1f4b196f5436d08c96c919764eb0901c2259146",
          "judgment_target_reference": "sha256:e94ec5621c2b0d2f5dba4f4ae5ec422031fd75674e2805f875accdd655a5f3d0"
        }
      ],
      "primary_package_reference": "sha256:66a064498d3f8a8e7825267a5a80c94b33f5ff06d99f176e87f0dd87b4a47a2b",
      "run_id": "run-01-aiq-001-weather",